{"schema_version":1,"run_id":"run-e2e","review_id":"review-codex-01","provider":"openai","client":"codex-cli","model":"recorded","role":"independent_reviewer","phase":"blind","base_sha":"6c9ad4f63d14223c7a449f238b863fcb5e9bb1aa","head_sha":"9e087cb9e20302af71f672559f8c25af990242bb","spec_sha256":"6bc7d2a9f5f01d8ac83e43885655810d34a70be4dfef8a749f706b0244570ca6","bundle_sha256":"dbb8a3b426da2157088ae6413efb547e7030401c9dcd240f821033eb213e9b7b","prompt_template_sha256":"4d2c9f90d50f45ce5ecb5d49e105a91219c33e90d505df8b61f7dc40c659b4ca","verdict":"changes_required","summary":"Cache map has a data race.","findings":[{"id":"COD-001","fingerprint":"CDNS-002/AC-006:concurrency:cache.go:race","origin":"blind_review","category":"concurrency","severity":"high","confidence":0.95,"acceptance_ids":["CDNS-002/AC-006"],"location":{"path":"internal/resolver/cache.go","start_line":40,"end_line":58},"claim":"Concurrent queries race on the cache map.","expected":"Concurrent access is synchronized.","actual":"Map written without a lock.","evidence_refs":["evidence/junit/race.xml"],"reproducer":{"kind":"test","ref":"test://internal/resolver::TestCacheConcurrent"},"suggested_remediation":"Guard with sync.RWMutex.","status":"open"}],"unreviewed_areas":[],"evidence_gaps":[],"completed_at":"2026-07-14T00:00:00Z"}
