{"schema_version":1,"run_id":"run-e2e","review_id":"review-claude-01","provider":"anthropic","client":"claude-code","model":"recorded","role":"independent_reviewer","phase":"blind","base_sha":"6c9ad4f63d14223c7a449f238b863fcb5e9bb1aa","head_sha":"9e087cb9e20302af71f672559f8c25af990242bb","spec_sha256":"6bc7d2a9f5f01d8ac83e43885655810d34a70be4dfef8a749f706b0244570ca6","bundle_sha256":"dbb8a3b426da2157088ae6413efb547e7030401c9dcd240f821033eb213e9b7b","prompt_template_sha256":"4d2c9f90d50f45ce5ecb5d49e105a91219c33e90d505df8b61f7dc40c659b4ca","verdict":"approve","summary":"No issues found.","findings":[],"unreviewed_areas":[],"evidence_gaps":[],"completed_at":"2026-07-14T00:00:00Z"}
